headline,link
Jalapeño Cheddar Popovers with Honey Butter.,https://www.halfbakedharvest.com/jalapeno-cheddar-popovers/
Creamy Vegan Chocolate Peanut Butter Fudge Bars.,https://www.halfbakedharvest.com/chocolate-peanut-butter-fudge-bars/
Detroit Style Tomato Herb Pepperoni Pizza.,https://www.halfbakedharvest.com/tomato-herb-pepperoni-pizza/
Chili Mango Summer Rolls with Ginger Peanut Sauce.,https://www.halfbakedharvest.com/summer-rolls/
Marinated Tomato Feta Orzo Salad Jars.,https://www.halfbakedharvest.com/orzo-salad-jars/
Strawberry Mojito.,https://www.halfbakedharvest.com/strawberry-mojito/
Strawberry Bourbon Crisp.,https://www.halfbakedharvest.com/strawberry-bourbon-crisp/
Roasted Garlic Butter Smashed Potatoes.,https://www.halfbakedharvest.com/garlic-butter-smashed-potatoes/
Crumbled Feta and Tomato Basil Vinaigrette Dip.,https://www.halfbakedharvest.com/crumbled-feta-and-tomato-basil-vinaigrette-dip/
Nine Favorite Things.,https://www.halfbakedharvest.com/nine-favorite-things-246/
Nine Favorite Things.,https://www.halfbakedharvest.com/nine-favorite-things-245/
Nine Favorite Things.,https://www.halfbakedharvest.com/nine-favorite-things-244/
Nine Favorite Things.,https://www.halfbakedharvest.com/nine-favorite-things-243/
Dad’s Easy Cheesy Eggs with Chili Butter.,https://www.halfbakedharvest.com/easy-cheesy-eggs/
Pull Apart French Toast Bake.,https://www.halfbakedharvest.com/pull-apart-french-toast-bake/
Blueberry Lemon Ricotta Sweet Rolls.,https://www.halfbakedharvest.com/blueberry-lemon-ricotta-sweet-rolls/
Crispy Parmesan and Pesto Egg in a Bagel.,https://www.halfbakedharvest.com/crispy-parmesan-and-pesto-egg-in-a-bagel/
Iced Lemon Loaf.,https://www.halfbakedharvest.com/iced-lemon-loaf/
Marinated Tomato Feta Orzo Salad Jars.,https://www.halfbakedharvest.com/orzo-salad-jars/
Taco Stuffed Avocados with Chipotle Sauce and Cilantro Lime Ranch.,https://www.halfbakedharvest.com/taco-stuffed-avocados/
Chili Mango Summer Rolls with Ginger Peanut Sauce.,https://www.halfbakedharvest.com/summer-rolls/
Detroit Style Tomato Herb Pepperoni Pizza.,https://www.halfbakedharvest.com/tomato-herb-pepperoni-pizza/
One Skillet Lemon Butter Dijon Chicken and Orzo with Feta Sauce.,https://www.halfbakedharvest.com/lemon-butter-dijon-chicken-and-orzo/
Creamy White Bean Lemon Pesto Orzo Soup.,https://www.halfbakedharvest.com/white-bean-lemon-pesto-orzo-soup/
Salted Tahini Oatmeal Chocolate Chip Cookies.,https://www.halfbakedharvest.com/tahini-oatmeal-chocolate-chip-cookies/
Creamy Sun-Dried Tomato Chicken Pasta.,https://www.halfbakedharvest.com/creamy-sun-dried-tomato-chicken-pasta/
The Studio Barn: Kitchen Appliances by KitchenAid.,https://www.halfbakedharvest.com/the-studio-barn-kitchen-appliances-by-kitchenaid/
Fall Entertaining At The Studio with Anthropologie.,https://www.halfbakedharvest.com/fall-entertaining-at-the-studio-with-anthropologie/
The HBH Studio Barn: Office.,https://www.halfbakedharvest.com/the-hbh-studio-barn-office/
The HBH Studio Barn: Kitchen and Downstairs Bath Plans.,https://www.halfbakedharvest.com/the-hbh-studio-barn-kitchen-and-downstairs-bath-plans/
A Sneak Peek Inside My Pantry… with Crate and Barrel!,https://www.halfbakedharvest.com/sneak-peek-inside-pantry-crate-barrel/
The Barn…it’s finally done…PHOTOS.,https://www.halfbakedharvest.com/the-barn-its-finally-done-photos/
The Barn…Progress Photos.,https://www.halfbakedharvest.com/barn-progress-photos/
The Barn: The Plans.,https://www.halfbakedharvest.com/barn-plans/
